vocab,phrase,status,date_added,tags
scowl,With what looked like a permanent scowl on his face.,New,,
wizened,He was a wizened little brown man.,New,,
companionship,Companionship that i needed there.,New,,
perking,"Heck, even riding along with my really strange little cabbie was perking me up.",New,,
considerate,Cabbies aren't usually so considerate.,New,,
profusely,I thanked him profusely.,New,,
run-down,Archie's bar is a typical if run-down neighborhood bar.,New,,
chitchatted,We chitchatted awhile.,New,,
